{"authority":{"authority_hash_contract":null,"score_pass_authority_hash":null,"selection_integration_config_hash":null},"identity":{"authority":{"authority_hash_contract":null,"score_pass_authority_hash":null,"selection_integration_config_hash":null},"nonselected_training_payload":[{"logical_id":"corridors/corridor_modes.json","semantic_digest":"sha256:4ca2a2d13b9b1ce11c2e73964e133ec3426e92fcfacfd4e999d56159d0e1ec89"},{"logical_id":"corridors/corridor_summary.json","semantic_digest":"sha256:7dcd983b89d970a0bd507d8fd181b4d9eb3098b91bdf79f04f373835b2aa7448"},{"logical_id":"corridors/mode_assignments.json","semantic_digest":"sha256:7b223fec5bbe6417e90ee3eb18834aeb1a379872a7ba1dd32573a059f805b2f4"},{"logical_id":"corridors/mode_assignments/examples_metadata.jsonl","semantic_digest":"sha256:2650ae98c9084ab12eac27e02f7499246c697de021d51355fe5ee8e904dea939"},{"logical_id":"corridors/mode_assignments/fingerprint_index.npy","semantic_digest":"sha256:e6095d7edc1a8ff39ae6b195cde075e23126833d9075db36ceb65685a119df6f"},{"logical_id":"corridors/mode_assignments/mode_id.npy","semantic_digest":"sha256:8c2f06a2cdfe41ce6c7f03c623462031674e39f4be790a072fa85db68b7d048e"},{"logical_id":"corridors/mode_assignments/position.npy","semantic_digest":"sha256:0be7c92b2cc3d470c540f9f5018931193863290beb7d9a0f61f9b471383b97c8"},{"logical_id":"corridors/mode_assignments/position_example_index.npy","semantic_digest":"sha256:a789609dd33c6aefa9e48e68e9d331642f6dc15da3f8845f4211ba16ee989d60"},{"logical_id":"corridors/mode_assignments/weight.npy","semantic_digest":"sha256:8878e1a4803f03da31924259bbdd1a2a3530b81eb580e14fdc3a55a7fd36f093"},{"logical_id":"curriculum/selected_routes.json","semantic_digest":"sha256:c5a3479301b1a4209b4cebe5f87a8fc5b5e766827c6e27e53c4293e09df230e6"},{"logical_id":"emission_config.json","semantic_digest":"sha256:5cd5e2da99a505f13b61428bd9064da0becc11e789fe486b0d8d118cf2d4a3a0"},{"logical_id":"leaderboards/selected_exemplars.json","semantic_digest":"sha256:73d1c785bbe211c20b8d61e0e00725a2ee08303d08c81480ca4147641aec75f0"},{"logical_id":"metadata.json","semantic_digest":"sha256:a7f90e7db9c01d294954a423859bf99b17d0239b434bc8742ac67a4f39fced22"},{"logical_id":"shards/shard-00000.npz","semantic_digest":"sha256:60f168b98897f807eb188664ec40aca5da247494e2ec48c913dc768aad18262b"},{"logical_id":"shards/shard-00001.npz","semantic_digest":"sha256:d7b86d66dcb012e1f74c267ee3c6fb74d633a4a67b20517a4f6084296e6d13bd"},{"logical_id":"teacher_manifest.json","semantic_digest":"sha256:caa9a98203bf884dc424cf6986bee91ff60b47461c0ffedf254de7ff6bc7033b"},{"logical_id":"vocab_contract.json","semantic_digest":"sha256:4668555e86dab73459dbf4aa7bef7f968522fb0ab66ee9108c3f637dd31f1e3c"}],"payload_sequence_digest":"sha256:2f458732a6b232491a94ec4933ab7060fc882c48677a7a7ffafd2c8e4ff60ff4","schema_version":"radjax_tome_semantic_identity_v2","selected_count":2,"semantic_digest":"sha256:0de8d0f45c22c5b8d092fdf6f69cd06d758b4aafe136f6dc6f1d6ce0636eb9ef","training_contract":{"sequence_length":8,"target_type":"corridor_exemplar_score_pass_v1","tome_version":null,"vocab_size":512}},"manifests":{"header":{"path":"manifests/content-manifest-header.json","schema_version":"tome_content_manifest_header_v3","sha256":"sha256:770bf033be5a7b8e65be574bd926e1e4221bc39064bd5dbb49a9f411cfe6f756","size_bytes":374}},"package":{"profile":"student","transport":"directory"},"provenance":{},"schema_version":"radjax_tome_cover_v4","training":{"sequence_length":8,"target_type":"corridor_exemplar_score_pass_v1","tome_version":null,"vocab_size":512},"validation":{}}